
https://lenta.ru/news/2023/04/08/prigozhin_macron/,"19:28, 8 апреля 2023",Пригожин попросил Макрона защитить сына главы Русского дома в ЦАР,"Глава частной военной компании (ЧВК) «Вагнер» Евгений Пригожин написал письмо президенту Франции Эммануэлю Макрону, в котором попросил защитить сына главы Русского дома в Центральноафриканской республике (ЦАР) Дмитрия Сытого. Письмо опубликовано в Telegram-канале пресс-службы бизнесмена."
https://lenta.ru/news/2023/04/08/taiwan_antiship/,"19:16, 8 апреля 2023",Тайвань развернул протикорабельные комплексы из-за учений Китая,"Вооруженные силы Тайваня развернули протикорабельные ракетные комплексы на тактических позициях из-за учений Китая у своих берегов. Об этом сообщает Центральное информационное агентство (CNA) Тайваня со ссылкой на поступившие в их распоряжение кадры.Очевидцы прислали видео колонны из военных грузовиков в уезде Пиндун, расположенного в южной части острова. Отмечается, что остальные автомобилисты подбадривали военных.По информации агентства, грузовики принадлежат ракетным частям Военно-морские силы (ВМС) Китайской Республики Тайвань. В связи с учениями Китая у берегов Тайваня им поступил приказ немедленно перебросить противокорабельные ракетные комплексы на тактические позиции и «встать на стражу морской и противовоздушной безопасности Тайваня».Ранее сообщалось, что Китай проводит трехдневные военные учения, цель которых — отработать окружение Тайваня. Сообщалось, что неофициальную границу между Тайванем и КНР пересекли уже 71 китайский военный самолет и девять военных кораблей.Новый виток напряженности связан с недавним визитом главы администрации Тайваня Цай Инвэнь в США, после которого американские конгрессмены заявили о готовности направить военных США на остров в случае вторжения Китая."
https://lenta.ru/news/2023/04/08/sevastopol/,"19:15, 8 апреля 2023",Глава Севастополя объяснил громкие звуки в центре города,"Громкие звуки в центре Севастополя связаны с работой по профилактике диверсантов. Так происходящее в своем Telegram-канале объяснил губернатор Михаил Развожаев.«Громкие звуки в центре города — это профилактическая работа в рамках ППДО (противоподводно-диверсионного обеспечения — прим. ""Ленты.ру"")», — написал он.Ранее глава Севастополя предупреждал, что 8 апреля жители города могут услышать звуки стрельбы. Он объяснил это учебной стрельбой Черноморского флота на Северном молу и успокоил местных жителей, сказав, что «в городе все спокойно»."
https://lenta.ru/news/2023/04/08/safronov_isk/,"19:12, 8 апреля 2023",Никас Сафронов подал многомиллиардный иск к Wildberries,"Российский художник Никас Сафронов подал многомиллиардный иск к маркетплейсу Wildberries. Об этом сообщает Telegram-канал Mash.Претензии у художника возникли из-за продажи на площадке товаров с его логотипом. Так, на маркетплейсе можно найти пакет-майку «Никас», набор для вышивания крестом «Никас» и прочие товары с этим лого.В иске, копия которого публикует Mash, Сафронов напомнил, что обладает исключительным правом на этот товарный знак и потребовал от маркетплейса выплатить 10 миллиардов рублей. Эту сумму авторы канала назвали «самым большим иском за всю историю российского искусства».В начале феврале сообщалось, что Никас Сафронов попал с больницу с сильным отравлением после съеденной банки вяленых помидоров."
https://lenta.ru/news/2023/04/08/330/,"19:08, 8 апреля 2023",Американский разведчик оценил число погибших и пропавших без вести военных ВСУ,"Вооруженные силы Украины (ВСУ) потеряли погибшими и пропавшими без вести свыше 330 тысяч солдат. Такую оценку дал экс-офицер разведки морской пехоты США Скотт Риттер в интервью YouTube-каналу U.S. Tour of Duty.«[Главком ВСУ Валерий] Залужный в разговоре с председателем Объединенного комитета начальников штабов Пентагона Марком Милли заявил, что 250 тысяч украинских военных погибли. Около 83 тысяч пропали без вести, из них примерно 60 тысяч, скорее всего, мертвы. Это дает примерное число в 315 тысяч погибших», — рассказал эксперт.По словам экс-разведчика, эти цифры соответствуют данным, которые поступают ему.Ранее председатель Комитета начальников штабов Вооруженных сил США генерал Марк Милли заявил, что шансы Украины на победу в военном конфликте с Россией можно назвать маловероятными. По его словам, Киеву вряд ли стоит рассчитывать на военный успех в 2023 году."
https://lenta.ru/news/2023/04/08/kara/,"19:03, 8 апреля 2023",Во время захвата храма канонической УПЦ на Украине умер один из рейдеров,"Во время захвата храма канонической Украинской православной церкви (УПЦ) в селе Липовец бывшего Кагарлыкского района Киевской области скоропостижно умер один из рейдеров заммэра Кагарлыка Иван Семцов. Об этом сообщается на сайте Союза православных журналистов Украины.Отмечается, что Семцов вместе со старостой села Липовец Василием Тысленко попытались захватить храм, используя для этого служебное положение. Во время конфликта во дворе храма заммэра вырвал из рук священника УПЦ крест и бросил его на землю.По свидетельству очевидцев, ему тут же стало плохо и он упал на землю. Все попытки привести его в чувство ничего не дали — мужчина скоропостижно скончался.В публикации отмечается, что в советское время погибший занимал пост инструктора Теребовлянского райкома Комсомола, затем был инструктором сельскохозяйственного отдела Кагарлыкского райкома КПСС, а после этого работал на должности инструктора организационного отдела.В октябре 2010 года Семцов был избран депутатом Белоцерковского районного совета от «Партии регионов», которую на Украине было принято считать пророссийской.В последние недели на Украине накалилась ситуация вокруг канонической УПЦ, отмечает ТАСС. Так, сторонники раскольнической Православной церкви Украины (ПЦУ) захватили Параскевскую церковь в Новом Корце Ровненской области, кафедральный собор УПЦ во Львове, храм в Черновицкой области. 2 апреля был захвачен кафедральный собор епархии УПЦ в Хмельницком. 3 апреля депутаты городских советов Каменца-Подольского и Хмельницкого приняли решение о лишении УПЦ права пользования земельными участками, на которых расположены ее храмы. 6 апреля мэр Львова Андрей Садовый заявил, что каноническая церковь прекратила свое существование в городе, поскольку у нее полностью отобрали собственность.Украинский национальный заповедник «Киево-Печерская лавра» обязал представителей УПЦ оставить территорию обители до 29 марта. В администрации заповедника заявили о расторжении договора — монахов заставили освободить являющиеся госсобственностью здания. На это в УПЦ ответили, что не собираются выполнять требования и переселяться из лавры, а также идти на компромисс с властями. 30 и 31 марта прихожане УПЦ не дали пройти комиссии заповедника к зданиям, которые они приехали проверять. Позднее там заметили полицейских с автоматами. Украинские силовики также подогнали автозаки к стенам Киево-Печерской лавры."
https://lenta.ru/news/2023/04/08/ukraine_bombs/,"18:44, 8 апреля 2023",На Украине признали проблемы с противостоянием новым авиабомбам России,"Украинской противовоздушной обороне (ПВО) нечем сбивать новый вид авиабомб, которые производит Россия. Проблемы с противостоянием этому типу вооружения признал спикер Воздушных сил (ВС) Вооруженных сил Украины (ВСУ) Юрий Игнат, передает «Политика Страны» в Telegram.Он заметил, что речь идет об авиабомбах весом полторы тонны. Игнат напомнил, что недавно министр обороны России Сергей Шойгу съездил на предприятие, где производят эти боеприпасы. Он также предположил, что новые бомбы будут оснащаться GPS-навигацией и крыльями.Игнат отметил, что среди наземных систем такому типу вооружения могут противостоять системы Samp-t и Patriot. Также с такими авибомбами могут бороться самолеты F-16 «или другие поколения 4+».«Следует понимать, что такие бомбы наносят удары с дистанции 50 плюс километров и по линии боевого столкновения или государственной границы. Поэтому их пока нечем доставать, именно запускающие их самолеты», — заключил спикер ВС ВСУ.В начале апреля Игнат рассказал, что Украина располагает тремя бригадами МиГ-29. Таким образом, на тот момент у страны было порядка 72 таких истребителей."
https://lenta.ru/news/2023/04/08/snaryad/,"18:42, 8 апреля 2023",Два подростка пострадали от взрыва снаряда в приграничном российском регионе,"В Новооскольском городском округе Белгородской области двое 17-летних подростков пострадали от взрыва снаряда времен Великой Отечественной войны (ВОВ). Об этом сообщил губернатор приграничного региона Вячеслав Гладков в Telegram.По его словам, подростки нашли ржавый снаряд, когда убирали мусор на огороде в селе Покрово-Михайловка. Мальчики решили разобрать боеприпас, распилив его, в результате чего произошел взрыв.Как рассказал российский губернатор, у одного из подростков легкая контузия, а второй получил осколочные ранения обоих ног и левой руки. Скорая помощь доставила пострадавших в Детскую областную больницу Белгорода.Гладков обратился к родителям с просьбой уделять больше внимания тому, чем занимаются дети.В декабре 2022 года в селе Щетиновка Белгородского района Белгородской области подросток наступил на взрывоопасный предмет, который сдетонировал. Сначала 14-летнего мальчика в тяжелом состоянии доставили в реанимацию местной больницы, позже перевезли на лечение в Москву."
